{
  "artifacts": {
    "client_request": "client-request.json",
    "expected_client_response": "expected-client-response.json",
    "expected_upstream_request": "expected-upstream-request.json",
    "upstream_response": "upstream-response.json"
  },
  "category": "fault",
  "direction": "responses_native",
  "does_not_prove": [
    "不规定 timeout 来源、deadline 传播或重试次数。"
  ],
  "expectation": {
    "classification": "native_only",
    "fallback_allowed": true,
    "invariants": [
      "504 是首输出前 HTTP error response",
      "网关超时与连接 abort 保持可区分"
    ],
    "outcome": "failed",
    "terminal": "none",
    "terminal_count": 0,
    "upstream_attempts": 1
  },
  "features": [
    "non_stream",
    "gateway_timeout"
  ],
  "id": "responses_native.gateway_timeout.non_stream",
  "provenance_ref": "sources/openbridge-design-policy.json",
  "proves": [
    "固定原生 Responses 504 JSON error envelope。"
  ],
  "recipes": [],
  "schema_version": "0.1",
  "status": "reviewed",
  "stream": false,
  "title": "Native Responses gateway timeout",
  "transport": {
    "cancellation_after_event": null,
    "client_content_type": "application/json",
    "client_end": "error_response",
    "client_http_status": 504,
    "downstream_output_observed": false,
    "failure_phase": "before_first_output",
    "upstream_content_type": "application/json",
    "upstream_end": "error_response",
    "upstream_http_status": 504
  }
}
