{
  "artifacts": {
    "client_request": "client-request.json",
    "expected_client_response": "expected-client-response.json",
    "expected_upstream_request": "expected-upstream-request.json",
    "upstream_response": "upstream-response.json"
  },
  "category": "fault",
  "direction": "responses_native",
  "does_not_prove": [
    "不规定模型别名解析或 endpoint capability probe。"
  ],
  "expectation": {
    "classification": "native_only",
    "fallback_allowed": false,
    "invariants": [
      "404 是 HTTP error response，不产生 SSE terminal",
      "资源不存在错误保留 JSON body"
    ],
    "outcome": "failed",
    "terminal": "none",
    "terminal_count": 0,
    "upstream_attempts": 1
  },
  "features": [
    "non_stream",
    "not_found"
  ],
  "id": "responses_native.not_found.non_stream",
  "provenance_ref": "sources/openbridge-design-policy.json",
  "proves": [
    "固定原生 Responses 404 JSON error envelope。"
  ],
  "recipes": [],
  "schema_version": "0.1",
  "status": "reviewed",
  "stream": false,
  "title": "Native Responses not found response",
  "transport": {
    "cancellation_after_event": null,
    "client_content_type": "application/json",
    "client_end": "error_response",
    "client_http_status": 404,
    "downstream_output_observed": false,
    "failure_phase": "before_first_output",
    "upstream_content_type": "application/json",
    "upstream_end": "error_response",
    "upstream_http_status": 404
  }
}
