{
  "artifacts": {
    "client_request": "client-request.json",
    "expected_client_response": "expected-client-response.json",
    "expected_upstream_request": "expected-upstream-request.json",
    "upstream_response": "upstream-response.json"
  },
  "category": "protocol",
  "direction": "chat_native",
  "does_not_prove": [
    "不执行工具，也不评估开放式最终回答质量。"
  ],
  "expectation": {
    "classification": "native_only",
    "fallback_allowed": false,
    "invariants": [
      "assistant tool_call 与 tool message 通过 tool_call_id 关联",
      "JSON 文本形式的工具结果保持原样",
      "最终 Chat response 只投影公开 model"
    ],
    "outcome": "completed",
    "terminal": "none",
    "terminal_count": 0,
    "upstream_attempts": 1
  },
  "features": [
    "function_tool",
    "tool_result",
    "non_stream",
    "identity",
    "structured_output"
  ],
  "id": "chat_native.tool_result.non_stream",
  "provenance_ref": "sources/openai-function-calling.json",
  "proves": [
    "提供 Native Chat function call/output 续接的非流式 wire oracle。"
  ],
  "recipes": [],
  "schema_version": "0.1",
  "status": "accepted",
  "stream": false,
  "title": "Native Chat tool result non-stream",
  "transport": {
    "cancellation_after_event": null,
    "client_content_type": "application/json",
    "client_end": "response",
    "client_http_status": 200,
    "downstream_output_observed": true,
    "failure_phase": "none",
    "upstream_content_type": "application/json",
    "upstream_end": "response",
    "upstream_http_status": 200
  }
}
